[
  {
    "id": "bot-kael",
    "name": "Kael",
    "race": "Nain",
    "class": "Guerrier",
    "personality": "cautious",
    "preferredActions": [
      "explore",
      "stealth",
      "support"
    ],
    "stats": {
      "str": 16,
      "dex": 10,
      "con": 14,
      "int": 8,
      "wis": 12,
      "cha": 10
    },
    "hp": 14,
    "ac": 16,
    "traits": [
      "protecteur",
      "méfiant"
    ]
  },
  {
    "id": "bot-lyra",
    "name": "Lyra",
    "race": "Elfe",
    "class": "Mage",
    "personality": "curious",
    "preferredActions": [
      "explore",
      "talk"
    ],
    "stats": {
      "str": 8,
      "dex": 14,
      "con": 10,
      "int": 16,
      "wis": 12,
      "cha": 10
    },
    "hp": 8,
    "ac": 12,
    "traits": [
      "curieuse",
      "analytique"
    ]
  },
  {
    "id": "bot-rook",
    "name": "Rook",
    "race": "Humain",
    "class": "Rôdeur",
    "personality": "bold",
    "preferredActions": [
      "explore",
      "stealth",
      "combat"
    ],
    "stats": {
      "str": 10,
      "dex": 16,
      "con": 12,
      "int": 10,
      "wis": 12,
      "cha": 14
    },
    "hp": 10,
    "ac": 14,
    "traits": [
      "impulsif",
      "courageux"
    ]
  },
  {
    "id": "bot-sera",
    "name": "Sera",
    "race": "Demi-elfe",
    "class": "Clerc",
    "personality": "diplomatic",
    "preferredActions": [
      "talk",
      "support"
    ],
    "stats": {
      "str": 10,
      "dex": 10,
      "con": 12,
      "int": 12,
      "wis": 16,
      "cha": 14
    },
    "hp": 11,
    "ac": 15,
    "traits": [
      "bienveillante",
      "persuasive"
    ]
  },
  {
    "id": "bot-thorn",
    "name": "Thorn",
    "race": "Orc",
    "class": "Barbare",
    "personality": "fierce",
    "preferredActions": [
      "combat",
      "explore"
    ],
    "stats": {
      "str": 18,
      "dex": 12,
      "con": 16,
      "int": 8,
      "wis": 10,
      "cha": 8
    },
    "hp": 16,
    "ac": 14,
    "traits": [
      "brutal",
      "têtu"
    ]
  },
  {
    "id": "bot-mira",
    "name": "Mira",
    "race": "Halfelin",
    "class": "Barde",
    "personality": "cheerful",
    "preferredActions": [
      "talk",
      "explore"
    ],
    "stats": {
      "str": 8,
      "dex": 14,
      "con": 10,
      "int": 12,
      "wis": 10,
      "cha": 16
    },
    "hp": 9,
    "ac": 13,
    "traits": [
      "drôle",
      "observatrice"
    ]
  },
  {
    "id": "bot-zara",
    "name": "Zara",
    "race": "Tieffelin",
    "class": "Occultiste",
    "personality": "mystic",
    "preferredActions": [
      "explore",
      "talk"
    ],
    "stats": {
      "str": 8,
      "dex": 12,
      "con": 12,
      "int": 14,
      "wis": 14,
      "cha": 16
    },
    "hp": 10,
    "ac": 13,
    "traits": [
      "énigmatique",
      "secrète"
    ]
  }
]
